[
  {
    "schema_version": "1.0",
    "employment_type": "full_time",
    "job_status": "active",
    "posting_date": "2026-01-01",
    "modified_date": null,
    "first_discovered_at": "2026-01-02T00:00:00Z",
    "last_verified_at": "2026-01-02T00:00:00Z",
    "application_url": null,
    "discovery_queries": [
      "synthetic query"
    ],
    "state": "MI",
    "country": "US",
    "metro_area": "Synthetic Metro",
    "office_attendance": null,
    "travel_percent_min": null,
    "travel_percent_max": null,
    "overnight_expectation": null,
    "compensation_currency": null,
    "base_compensation_min": null,
    "base_compensation_max": null,
    "compensation_period": null,
    "bonus_information": null,
    "commission_information": null,
    "equity_information": null,
    "vehicle_information": null,
    "compensation_source_text": null,
    "preferred_qualifications": [],
    "technologies": [],
    "education_requirements": [],
    "experience_years_min": null,
    "experience_years_max": null,
    "dealer_facing": true,
    "people_leadership": null,
    "quota_or_portfolio_ownership": null,
    "role_family": null,
    "role_subfamily": null,
    "classification_confidence": null,
    "scrape_id": null,
    "raw_snapshot_reference": "fixture:synthetic-jobs",
    "provenance": [],
    "source_sightings": [],
    "audit_events": [],
    "job_id": "job-1",
    "company_name": "Example Mobility Company",
    "title": "Dealer Performance Manager",
    "requisition_id": "REQ-100",
    "source_url": "https://careers.example.com/jobs/100?utm_source=test",
    "canonical_source_url": "https://careers.example.com/jobs/100?utm_source=test",
    "source_type": "official_employer",
    "source_authority": null,
    "employer_domain": "careers.example.com",
    "official_source": true,
    "city": "Example City",
    "work_model": "field_based",
    "field_based": true,
    "summary": "Fictional role for deterministic testing.",
    "responsibilities": [
      "Support dealer performance and field operations."
    ],
    "required_qualifications": [
      "Documented dealer relationship experience"
    ],
    "unknown_fields": [],
    "conflicts": []
  },
  {
    "schema_version": "1.0",
    "employment_type": "full_time",
    "job_status": "active",
    "posting_date": "2026-01-01",
    "modified_date": null,
    "first_discovered_at": "2026-01-02T00:00:00Z",
    "last_verified_at": "2026-01-02T00:00:00Z",
    "application_url": null,
    "discovery_queries": [
      "synthetic query"
    ],
    "state": "MI",
    "country": "US",
    "metro_area": "Synthetic Metro",
    "office_attendance": null,
    "travel_percent_min": null,
    "travel_percent_max": null,
    "overnight_expectation": null,
    "compensation_currency": null,
    "base_compensation_min": null,
    "base_compensation_max": null,
    "compensation_period": null,
    "bonus_information": null,
    "commission_information": null,
    "equity_information": null,
    "vehicle_information": null,
    "compensation_source_text": null,
    "preferred_qualifications": [],
    "technologies": [],
    "education_requirements": [],
    "experience_years_min": null,
    "experience_years_max": null,
    "dealer_facing": true,
    "people_leadership": null,
    "quota_or_portfolio_ownership": null,
    "role_family": null,
    "role_subfamily": null,
    "classification_confidence": null,
    "scrape_id": null,
    "raw_snapshot_reference": "fixture:synthetic-jobs",
    "provenance": [],
    "source_sightings": [],
    "audit_events": [],
    "job_id": "job-1-agg",
    "company_name": "Example Mobility Company",
    "title": "Dealer Performance Manager",
    "requisition_id": "REQ-100",
    "source_url": "https://jobs.example.net/100",
    "canonical_source_url": "https://jobs.example.net/100",
    "source_type": "aggregator",
    "source_authority": null,
    "employer_domain": "careers.example.com",
    "official_source": false,
    "city": "Example City",
    "work_model": "remote",
    "field_based": false,
    "summary": "Fictional role for deterministic testing.",
    "responsibilities": [
      "Support dealer performance and field operations."
    ],
    "required_qualifications": [
      "Documented dealer relationship experience"
    ],
    "unknown_fields": [],
    "conflicts": []
  },
  {
    "schema_version": "1.0",
    "employment_type": "full_time",
    "job_status": "active",
    "posting_date": "2026-01-01",
    "modified_date": null,
    "first_discovered_at": "2026-01-02T00:00:00Z",
    "last_verified_at": "2026-01-02T00:00:00Z",
    "application_url": null,
    "discovery_queries": [
      "synthetic query"
    ],
    "state": "MI",
    "country": "US",
    "metro_area": "Synthetic Metro",
    "office_attendance": null,
    "travel_percent_min": null,
    "travel_percent_max": null,
    "overnight_expectation": null,
    "compensation_currency": null,
    "base_compensation_min": null,
    "base_compensation_max": null,
    "compensation_period": null,
    "bonus_information": null,
    "commission_information": null,
    "equity_information": null,
    "vehicle_information": null,
    "compensation_source_text": null,
    "preferred_qualifications": [],
    "technologies": [],
    "education_requirements": [],
    "experience_years_min": null,
    "experience_years_max": null,
    "dealer_facing": true,
    "people_leadership": null,
    "quota_or_portfolio_ownership": null,
    "role_family": null,
    "role_subfamily": null,
    "classification_confidence": null,
    "scrape_id": null,
    "raw_snapshot_reference": "fixture:synthetic-jobs",
    "provenance": [],
    "source_sightings": [],
    "audit_events": [],
    "job_id": "job-2",
    "company_name": "Example Mobility Company",
    "title": "Dealer Performance Manager",
    "requisition_id": "REQ-200",
    "source_url": "https://ats.example.org/tenant/jobs/200",
    "canonical_source_url": "https://ats.example.org/tenant/jobs/200",
    "source_type": "official_ats",
    "source_authority": null,
    "employer_domain": "careers.example.com",
    "official_source": true,
    "city": "Other City",
    "work_model": "on_site",
    "field_based": false,
    "summary": "Fictional role for deterministic testing.",
    "responsibilities": [
      "Support dealer performance and field operations."
    ],
    "required_qualifications": [
      "Documented dealer relationship experience"
    ],
    "unknown_fields": [],
    "conflicts": []
  },
  {
    "schema_version": "1.0",
    "employment_type": "full_time",
    "job_status": "active",
    "posting_date": "2026-01-01",
    "modified_date": null,
    "first_discovered_at": "2026-01-02T00:00:00Z",
    "last_verified_at": "2026-01-02T00:00:00Z",
    "application_url": null,
    "discovery_queries": [
      "synthetic query"
    ],
    "state": "MI",
    "country": "US",
    "metro_area": "Synthetic Metro",
    "office_attendance": null,
    "travel_percent_min": null,
    "travel_percent_max": null,
    "overnight_expectation": null,
    "compensation_currency": null,
    "base_compensation_min": null,
    "base_compensation_max": null,
    "compensation_period": null,
    "bonus_information": null,
    "commission_information": null,
    "equity_information": null,
    "vehicle_information": null,
    "compensation_source_text": null,
    "preferred_qualifications": [],
    "technologies": [],
    "education_requirements": [],
    "experience_years_min": null,
    "experience_years_max": null,
    "dealer_facing": true,
    "people_leadership": null,
    "quota_or_portfolio_ownership": null,
    "role_family": null,
    "role_subfamily": null,
    "classification_confidence": null,
    "scrape_id": null,
    "raw_snapshot_reference": "fixture:synthetic-jobs",
    "provenance": [],
    "source_sightings": [],
    "audit_events": [],
    "job_id": "job-3",
    "company_name": "Example Mobility Company",
    "title": "Mystery Coordinator",
    "requisition_id": null,
    "source_url": "https://careers.example.com/jobs/300",
    "canonical_source_url": "https://careers.example.com/jobs/300",
    "source_type": "official_employer",
    "source_authority": null,
    "employer_domain": "careers.example.com",
    "official_source": true,
    "city": "Example City",
    "work_model": "unknown",
    "field_based": false,
    "summary": "Fictional role for deterministic testing.",
    "responsibilities": [
      "Support dealer performance and field operations."
    ],
    "required_qualifications": [
      "Unspecified specialist capability"
    ],
    "unknown_fields": [],
    "conflicts": []
  },
  {
    "schema_version": "1.0",
    "employment_type": "full_time",
    "job_status": "inactive",
    "posting_date": "2026-01-01",
    "modified_date": null,
    "first_discovered_at": "2026-01-02T00:00:00Z",
    "last_verified_at": "2026-01-02T00:00:00Z",
    "application_url": null,
    "discovery_queries": [
      "synthetic query"
    ],
    "state": "MI",
    "country": "US",
    "metro_area": "Synthetic Metro",
    "office_attendance": null,
    "travel_percent_min": null,
    "travel_percent_max": null,
    "overnight_expectation": null,
    "compensation_currency": null,
    "base_compensation_min": null,
    "base_compensation_max": null,
    "compensation_period": null,
    "bonus_information": null,
    "commission_information": null,
    "equity_information": null,
    "vehicle_information": null,
    "compensation_source_text": null,
    "preferred_qualifications": [],
    "technologies": [],
    "education_requirements": [],
    "experience_years_min": null,
    "experience_years_max": null,
    "dealer_facing": true,
    "people_leadership": null,
    "quota_or_portfolio_ownership": null,
    "role_family": null,
    "role_subfamily": null,
    "classification_confidence": null,
    "scrape_id": null,
    "raw_snapshot_reference": "fixture:synthetic-jobs",
    "provenance": [],
    "source_sightings": [],
    "audit_events": [],